{
  "schema_version": "apxm.air",
  "semantic_operations": [
    {
      "node_id": "fixture.new",
      "op": "program.new",
      "parent_region_id": "fixture.root",
      "execution_order": 0,
      "operands": [
        { "slot": "program_ref", "value_id": "fixture.child", "type_ref": "ProgramRef" }
      ],
      "result": { "value_id": "fixture.instance", "type_ref": "ProgramInstanceRef" }
    },
    {
      "node_id": "fixture.invoke",
      "op": "program.invoke",
      "parent_region_id": "fixture.root",
      "execution_order": 1,
      "operands": [
        { "slot": "receiver", "value_id": "fixture.instance", "type_ref": "ProgramInstanceRef" },
        { "slot": "input", "value_id": "fixture.input", "type_ref": "ProgramInput" }
      ],
      "result": { "value_id": "fixture.output", "type_ref": "ProgramOutput" }
    },
    {
      "node_id": "fixture.await",
      "op": "await.event",
      "parent_region_id": "fixture.root",
      "execution_order": 2,
      "operands": [
        { "slot": "event_ref", "value_id": "fixture.ready", "type_ref": "EventRef" }
      ],
      "result": { "value_id": "fixture.event_output", "type_ref": "EventOutput" }
    }
  ],
  "structural_ir": [
    { "region_id": "fixture.root", "kind": "function", "execution_order": 0 }
  ],
  "context_flow": [],
  "source_map": {
    "schema_version": "apxm.source-map",
    "source_language": "python",
    "node_spans": [],
    "region_annotations": []
  }
}
